{
  "schemaVersion": "agent-registry.agent-admission-manifest.v0.1",
  "recordType": "AgentAdmissionManifest",
  "agent_id": "splunk-mcp-server",
  "source": {
    "repo": "SCOPE-D",
    "path": "mcp.json",
    "kind": "mcp-server"
  },
  "declared_capabilities": [
    "cmd:bash",
    "cmd:npx"
  ],
  "admission_status": "admitted",
  "production_admitted": true,
  "risk_class": "destructive-offensive",
  "authority": {
    "granted": true,
    "authority_refs": [
      "grant://agent/splunk-mcp-server/mcp-exec",
      "policy://containment/mcp-exec-sandbox-v0.1",
      "policy://trustops/agent-authority-v0.1",
      "standard://socioprophet-agent-standards/030",
      "evidence://agent-registry/owner-signoff/2026-08-02-agent-admissions"
    ],
    "owner_repo": "SocioProphet/SCOPE-D",
    "approval_required_from": "SocioProphet/SCOPE-D agent owner",
    "sign_off": {
      "approver": "owner://socioprophet/lord-michael",
      "decision": "admitted",
      "approval_channel": "in-session-verbal",
      "decided_at": "2026-08-02T00:00:00Z",
      "evidence_ref": "evidence://agent-registry/owner-signoff/2026-08-02-agent-admissions",
      "evidence_record_path": "governance/owner-signoffs/2026-08-02-agent-admissions.json",
      "gap_refs": [
        "SocioProphet/agent-registry#53",
        "SocioProphet/agent-registry#54",
        "SocioProphet/agent-registry#55"
      ],
      "containment_ref": "policy://containment/mcp-exec-sandbox-v0.1",
      "containment_required": true
    }
  },
  "invariant": "INV-ACC-1",
  "standard_ref": "socioprophet-agent-standards/docs/standards/030",
  "gap_ref": "SocioProphet/agent-registry#53",
  "non_claims": [
    "ADMITTED per owner sign-off (Lord Michael, 2026-08-02); authority.granted is true.",
    "Admission makes this agent VISIBLE + admitted -- it does NOT hand it unconditional authority. The runtime authority state and the fail-closed authorize gate (tools/authorize.py) still govern each individual action dimension; a destructive verb is only exercised under the containment ref (policy://containment/mcp-exec-sandbox-v0.1).",
    "authority_refs carry the warranting owner grant, the governing Standard 030 / trustops policy, the owner sign-off evidence, and the CONTAINMENT ref -- approval is governed, not omnipotent."
  ],
  "notes": "ADMITTED: Splunk MCP arbitrary command surface (cmd:bash / cmd:npx). Owner (SocioProphet/SCOPE-D / Lord Michael) signed off 2026-08-02 (evidence evidence://agent-registry/owner-signoff/2026-08-02-agent-admissions); the runtime admission gate (tools/authorize.py, SocioProphet/agent-registry#55) now resolves this ref to admitted (was review-required). Governed, not unconditional: the per-action authority state still gates each action and the destructive/offensive capability is bounded by the containment ref policy://containment/mcp-exec-sandbox-v0.1."
}
